Author-Paper Id,author_id,Title,Year,Citations
gAxRsSAAAAAJ:QUX0mv85b1cC,gAxRsSAAAAAJ,The structuring of organizations,1989,20199
gAxRsSAAAAAJ:CaZNVDsoPx4C,gAxRsSAAAAAJ,Nature of managerial work,1973,16688
gAxRsSAAAAAJ:yB1At4FlUx8C,gAxRsSAAAAAJ,Nature of managerial work,1973,16640
gAxRsSAAAAAJ:tS2w5q8j5-wC,gAxRsSAAAAAJ,The rise and fall of strategic planning,2000,12751
gAxRsSAAAAAJ:Tiz5es2fbqcC,gAxRsSAAAAAJ,Structure in fives: Designing effective organizations.,1993,9469
gAxRsSAAAAAJ:eJXPG6dFmWUC,gAxRsSAAAAAJ,Strategy safari: The complete guide through the wilds of strategic management,2020,9221
gAxRsSAAAAAJ:tOudhMTPpwUC,gAxRsSAAAAAJ,"Of strategies, deliberate and emergent",1985,9063
gAxRsSAAAAAJ:geHnlv5EZngC,gAxRsSAAAAAJ,Patterns in strategy formation,1978,7771
gAxRsSAAAAAJ:PVjk1bu6vJQC,gAxRsSAAAAAJ,Power in and around organizations,1983,7106
gAxRsSAAAAAJ:sSrBHYA8nusC,gAxRsSAAAAAJ,"The structure of"" unstructured"" decision processes",1976,6972
r4ZImFAAAAAJ:WwIwg2wKZ0QC,r4ZImFAAAAAJ,User acceptance of computer technology: a comparison of two theoretical models,1989,40259
r4ZImFAAAAAJ:4Yq6kJLCcecC,r4ZImFAAAAAJ,On the evaluation of structural equation models,1988,36498
r4ZImFAAAAAJ:9yKSN-GCB0IC,r4ZImFAAAAAJ,Extrinsic and Intrinsic Motivation to Use Computers in the Workplace1,1992,10115
r4ZImFAAAAAJ:d1gkVwhDpl0C,r4ZImFAAAAAJ,Assessing construct validity in organizational research,1991,9075
r4ZImFAAAAAJ:IjCSPb-OGe4C,r4ZImFAAAAAJ,The role of emotions in marketing,1999,5249
r4ZImFAAAAAJ:RYcK_YlVTxYC,r4ZImFAAAAAJ,"Specification, evaluation, and interpretation of structural equation models",2012,4359
r4ZImFAAAAAJ:DXE8ND7PrJAC,r4ZImFAAAAAJ,marketing as exchange,1975,3984
r4ZImFAAAAAJ:eQOLeE2rZwMC,r4ZImFAAAAAJ,A social influence model of consumer participation in network-and small-group-based virtual communities,2004,3655
r4ZImFAAAAAJ:zYLM7Y9cAGgC,r4ZImFAAAAAJ,"The self-regulation of attitudes, intentions, and behavior",1992,3527
r4ZImFAAAAAJ:2osOgNQ5qMEC,r4ZImFAAAAAJ,Representing and testing organizational theories: A holistic construal,1982,3502
kbmkIQQAAAAJ:4hFrxpcac9AC,kbmkIQQAAAAJ,Aplikasi analisis multivariete dengan program IBM SPSS 23,2016,136474
kbmkIQQAAAAJ:IjCSPb-OGe4C,kbmkIQQAAAAJ,Structural equation modeling: Metode alternatif dengan partial least square (pls),2008,6216
kbmkIQQAAAAJ:1yWc8FF-_SYC,kbmkIQQAAAAJ,"Partial least squares konsep, teknik dan aplikasi menggunakan program smartpls 3.0 untuk penelitian empiris",2015,4779
kbmkIQQAAAAJ:Vr2j17o0sqMC,kbmkIQQAAAAJ,Aplikasi analisis multivariate dengan SPSS,2005,3744
kbmkIQQAAAAJ:QoJ_w57xiyAC,kbmkIQQAAAAJ,Model persamaan struktural: Konsep dan aplikasi dengan program AMOS 16.0,2008,3229
kbmkIQQAAAAJ:PZE8UkGerEcC,kbmkIQQAAAAJ,"Analisis multivariat dan ekonometrika: teori, konsep, dan aplikasi dengan eview 10",2017,2889
kbmkIQQAAAAJ:YsMSGLbcyi4C,kbmkIQQAAAAJ,Teori Akuntansi Internasional Financial Reporting Systems (IFRS),2016,2122
kbmkIQQAAAAJ:Tyk-4Ss8FVUC,kbmkIQQAAAAJ,"Ekonometrika teori, konsep dan aplikasi dengan SPSS 17",2009,1721
kbmkIQQAAAAJ:eFf2swCANGcC,kbmkIQQAAAAJ,Structural equation modeling,2008,1369
kbmkIQQAAAAJ:Y0pCki6q_DkC,kbmkIQQAAAAJ,Teori akuntansi,2007,1203
C-7sFjEAAAAJ:u5HHmVD_uO8C,C-7sFjEAAAAJ,User acceptance of information technology: Toward a unified view,2003,51540
C-7sFjEAAAAJ:u-x6o8ySG0sC,C-7sFjEAAAAJ,A theoretical extension of the technology acceptance model: Four longitudinal field studies,2000,31363
C-7sFjEAAAAJ:kzcrU_BdoSEC,C-7sFjEAAAAJ,Consumer acceptance and use of information technology: extending the unified theory of acceptance and use of technology,2012,16119
C-7sFjEAAAAJ:d1gkVwhDpl0C,C-7sFjEAAAAJ,"Determinants of perceived ease of use: Integrating control, intrinsic motivation, and emotion into the technology acceptance model",2000,10105
C-7sFjEAAAAJ:W7OEmFMy1HYC,C-7sFjEAAAAJ,Technology acceptance model 3 and a research agenda on interventions,2008,9935
C-7sFjEAAAAJ:9yKSN-GCB0IC,C-7sFjEAAAAJ,"Why don't men ever stop to ask for directions? Gender, social influence, and their role in technology acceptance and usage behavior",2000,6623
C-7sFjEAAAAJ:2osOgNQ5qMEC,C-7sFjEAAAAJ,A model of the antecedents of perceived ease of use: Development and test,1996,6123
C-7sFjEAAAAJ:b0M2c_1WBrUC,C-7sFjEAAAAJ,Bridging the qualitative-quantitative divide: Guidelines for conducting mixed methods research in information systems,2013,3914
C-7sFjEAAAAJ:geHnlv5EZngC,C-7sFjEAAAAJ,Unified Theory of Acceptance and Use of Technology: A Synthesis and the Road Ahead,2016,2554
C-7sFjEAAAAJ:zYLM7Y9cAGgC,C-7sFjEAAAAJ,Age differences in technology adoption decisions: Implications for a changing work force,2000,2519
pAt6DnIAAAAJ:5bg8sr1QxYwC,pAt6DnIAAAAJ,Organizational behavior: An evidence-based approach,2011,18802
pAt6DnIAAAAJ:9Nmd_mFXekcC,pAt6DnIAAAAJ,Positive psychological capital: Measurement and relationship with performance and satisfaction,2007,7301
pAt6DnIAAAAJ:dhFuZR0502QC,pAt6DnIAAAAJ,Self-efficacy and work-related performance: A meta-analysis.,1998,6592
pAt6DnIAAAAJ:geHnlv5EZngC,pAt6DnIAAAAJ,Psychological capital: Developing the human competitive edge,2006,6438
pAt6DnIAAAAJ:ZHo1McVdvXMC,pAt6DnIAAAAJ,The need for and meaning of positive organizational behavior,2002,5784
pAt6DnIAAAAJ:NxmKEeNBbOMC,pAt6DnIAAAAJ,Perilaku organisasi,2006,5731
pAt6DnIAAAAJ:cWzG1nlazyYC,pAt6DnIAAAAJ,Unlocking the mask: A look at the process by which authentic leaders impact follower attitudes and behaviors,2004,4475
pAt6DnIAAAAJ:mWEH9CqjF64C,pAt6DnIAAAAJ,“Can you see the real me?” A self-based model of authentic leader and follower development,2005,4090
pAt6DnIAAAAJ:WAzi4Gm8nLoC,pAt6DnIAAAAJ,Authentic leadership development,2003,3997
pAt6DnIAAAAJ:HtEfBTGE9r8C,pAt6DnIAAAAJ,"Human, social, and now positive psychological capital management: Investing in people for competitive advantage",2004,3941
_j5GJoUAAAAJ:lIeuKFitLToC,_j5GJoUAAAAJ,"Worldwide trends in body-mass index, underweight, overweight, and obesity from 1975 to 2016: a pooled analysis of 2416 population-based measurement studies in 128· 9 million children, adolescents, and adults",2017,7715
_j5GJoUAAAAJ:n5u26LFhhPsC,_j5GJoUAAAAJ,Worldwide trends in diabetes since 1980: a pooled analysis of 751 population-based studies with 4· 4 million participants,2016,4086
_j5GJoUAAAAJ:8dmKnlANe1sC,_j5GJoUAAAAJ,Worldwide trends in blood pressure from 1975 to 2015: a pooled analysis of 1479 population-based measurement studies with 19· 1 million participants,2017,2643
_j5GJoUAAAAJ:GL0K47J-u9kC,_j5GJoUAAAAJ,New genetic loci implicated in fasting glucose homeostasis and their impact on type 2 diabetes risk,2010,2504
_j5GJoUAAAAJ:-EqDysdaREAC,_j5GJoUAAAAJ,Large-scale association analysis identifies 13 new susceptibility loci for coronary artery disease,2011,2183
_j5GJoUAAAAJ:7Frjd3zlGBUC,_j5GJoUAAAAJ,Global and regional effects of potentially modifiable risk factors associated with acute stroke in 32 countries (INTERSTROKE): a case-control study,2016,2121
_j5GJoUAAAAJ:oTdOBqtIf_kC,_j5GJoUAAAAJ,The plant traits that drive ecosystems: evidence from three continents,2004,1731
_j5GJoUAAAAJ:UlRcoTO8nVoC,_j5GJoUAAAAJ,Large-scale association analysis identifies new risk loci for coronary artery disease,2013,1718
_j5GJoUAAAAJ:_9cyEV96HHsC,_j5GJoUAAAAJ,Genome-wide association study of blood pressure and hypertension,2009,1619
_j5GJoUAAAAJ:bZtZ2VP7DRgC,_j5GJoUAAAAJ,Fine-mapping type 2 diabetes loci to single-variant resolution using high-density imputation and islet-specific epigenome maps,2018,1539
APhUMtEAAAAJ:NZNkWSpQBv0C,APhUMtEAAAAJ,R&D spillovers and the geography of innovation and production,1996,8584
APhUMtEAAAAJ:oFn-K-OQSCAC,APhUMtEAAAAJ,Innovation and small firms,1990,3686
APhUMtEAAAAJ:V3AGJWp-ZtQC,APhUMtEAAAAJ,Innovation in large and small firms: an empirical analysis,1988,3680
APhUMtEAAAAJ:4aZ_i-5WJEQC,APhUMtEAAAAJ,Innovation and industry evolution,1995,3354
APhUMtEAAAAJ:IsPWOBWtZBwC,APhUMtEAAAAJ,"Innovation in cities:: Science-based diversity, specialization and localized competition",1999,3044
APhUMtEAAAAJ:4DMP91E08xMC,APhUMtEAAAAJ,The geography of innovation,1994,2569
APhUMtEAAAAJ:tkaPQYYpVKoC,APhUMtEAAAAJ,The knowledge spillover theory of entrepreneurship,2009,2350
APhUMtEAAAAJ:HIFyuExEbWQC,APhUMtEAAAAJ,Entrepreneurship and economic growth,2006,2224
APhUMtEAAAAJ:J3LtWjKFLicC,APhUMtEAAAAJ,"Innovation, market structure, and firm size",1987,1967
APhUMtEAAAAJ:U4n9YNQMCAIC,APhUMtEAAAAJ,Knowledge spillovers and the geography of innovation,2004,1922
YmoiCIcAAAAJ:86PQX7AUzd4C,YmoiCIcAAAAJ,Structural holes,2018,35751
YmoiCIcAAAAJ:k8Z6L05lTy4C,YmoiCIcAAAAJ,Not so different after all: A cross-discipline view of trust,1998,15979
YmoiCIcAAAAJ:HDshCWvjkbEC,YmoiCIcAAAAJ,Structural holes and good ideas,2004,8000
YmoiCIcAAAAJ:UeHWp8X0CEIC,YmoiCIcAAAAJ,The network structure of social capital,2000,7090
YmoiCIcAAAAJ:q3oQSFYPqjQC,YmoiCIcAAAAJ,The contingent value of social capital,2009,6094
YmoiCIcAAAAJ:4OULZ7Gr8RgC,YmoiCIcAAAAJ,Brokerage and closure: An introduction to social capital,2007,5730
YmoiCIcAAAAJ:b1wdh0AR-JQC,YmoiCIcAAAAJ,Social contagion and innovation: Cohesion versus structural equivalence,1987,3743
YmoiCIcAAAAJ:1yQoGdGgb4wC,YmoiCIcAAAAJ,Structural holes versus network closure as social capital,2017,3491
YmoiCIcAAAAJ:mVmsd5A6BfQC,YmoiCIcAAAAJ,Toward a structural theory of action,1982,3445
YmoiCIcAAAAJ:tS2w5q8j5-wC,YmoiCIcAAAAJ,Network items and the general social survey,1984,1819
xsQ0B9IAAAAJ:cww_0JKUTDwC,xsQ0B9IAAAAJ,Reflexive methodology: New vistas for qualitative research,2017,12519
xsQ0B9IAAAAJ:2osOgNQ5qMEC,xsQ0B9IAAAAJ,Tolkning och reflektion: vetenskapsfilosofi och kvalitativ metod,2008,9464
xsQ0B9IAAAAJ:9yKSN-GCB0IC,xsQ0B9IAAAAJ,Understanding organizational culture,2012,4763
xsQ0B9IAAAAJ:UeHWp8X0CEIC,xsQ0B9IAAAAJ,Identity regulation as organizational control: Producing the appropriate individual,2002,3907
xsQ0B9IAAAAJ:qSd0DAb9jMoC,xsQ0B9IAAAAJ,Doing critical management research,1999,3416
xsQ0B9IAAAAJ:IjCSPb-OGe4C,xsQ0B9IAAAAJ,Varieties of discourse: On the study of organizations through discourse analysis,2000,2926
xsQ0B9IAAAAJ:WF5omc3nYNoC,xsQ0B9IAAAAJ,"Beyond neopositivists, romantics, and localists: A reflexive approach to interviews in organizational research",2003,2710
xsQ0B9IAAAAJ:UebtZRa9Y70C,xsQ0B9IAAAAJ,"Managing managerial identities: Organizational fragmentation, discourse and identity struggle",2003,2470
xsQ0B9IAAAAJ:BqipwSGYUEgC,xsQ0B9IAAAAJ,Generating research questions through problematization,2011,2354
xsQ0B9IAAAAJ:qjMakFHDy7sC,xsQ0B9IAAAAJ,Making sense of management: A critical introduction,2012,2214
AZxJWdcAAAAJ:u5HHmVD_uO8C,AZxJWdcAAAAJ,Common method biases in behavioral research: a critical review of the literature and recommended remedies.,2003,75923
AZxJWdcAAAAJ:UeHWp8X0CEIC,AZxJWdcAAAAJ,Sources of method bias in social science research and recommendations on how to control it,2012,13281
AZxJWdcAAAAJ:u-x6o8ySG0sC,AZxJWdcAAAAJ,Individual-and organizational-level consequences of organizational citizenship behaviors: A meta-analysis.,2009,3664
AZxJWdcAAAAJ:qjMakFHDy7sC,AZxJWdcAAAAJ,Construct measurement and validation procedures in MIS and behavioral research: Integrating new and existing techniques,2011,3592
AZxJWdcAAAAJ:9yKSN-GCB0IC,AZxJWdcAAAAJ,A meta-analytic test of the challenge stressor–hindrance stressor framework: An explanation for inconsistent relationships among stressors and performance,2005,3054
AZxJWdcAAAAJ:d1gkVwhDpl0C,AZxJWdcAAAAJ,"Differential challenge stressor-hindrance stressor relationships with job attitudes, turnover intentions, turnover, and withdrawal behavior: a meta-analysis.",2007,2637
AZxJWdcAAAAJ:Y0pCki6q_DkC,AZxJWdcAAAAJ,The relationship between pay and job satisfaction: A meta-analysis of the literature,2010,1165
AZxJWdcAAAAJ:2osOgNQ5qMEC,AZxJWdcAAAAJ,The influence of management journals in the 1980s and 1990s,2005,1025
AZxJWdcAAAAJ:IjCSPb-OGe4C,AZxJWdcAAAAJ,"Relationships between leader reward and punishment behavior and subordinate attitudes, perceptions, and behaviors: A meta-analytic review of existing and new research",2006,699
AZxJWdcAAAAJ:M3ejUd6NZC8C,AZxJWdcAAAAJ,"Recommendations for creating better concept definitions in the organizational, behavioral, and social sciences",2016,668
